{
  "reference_id": "demo-reference-1",
  "scene": "\u57ce\u5e02\u591c\u666f\u73bb\u7483\u5e55\u5899",
  "background_story": "\u5229\u7528\u53cd\u5c04\u5f62\u6210\u672a\u6765\u611f\u548c\u5b64\u72ec\u6c1b\u56f4",
  "lighting": "\u4fa7\u540e\u65b9\u51b7\u8272\u5149",
  "composition": "\u4e09\u5206\u6cd5\uff0c\u4eba\u7269\u4f4d\u4e8e\u53f3\u4fa7",
  "subject_intent": "\u8eab\u4f53\u5fae\u4fa7\uff0c\u80a9\u8180\u653e\u677e",
  "emotion": "\u5b89\u9759\u7b49\u5f85",
  "pose_template": "\u6587\u5b57\u53c2\u8003\uff1a\u8eab\u4f53\u5fae\u4fa7\uff0c\u89c6\u7ebf\u8d8a\u8fc7\u955c\u5934\uff0c\u4e0d\u8fdb\u884c\u5b9e\u65f6\u9aa8\u67b6\u68c0\u6d4b\u3002",
  "camera_position": "\u7565\u4f4e\u673a\u4f4d\uff0c45 \u5ea6\u4fa7\u5411\u53d6\u666f\u3002",
  "director_prompt": "\u5148\u786e\u8ba4\u73bb\u7483\u53cd\u5c04\u4e0e\u4eba\u7269\u9519\u5f00\uff0c\u518d\u628a\u4eba\u7269\u653e\u5728\u53f3\u4fa7\u4e09\u5206\u7ebf\u5e76\u4fdd\u7559\u5de6\u4fa7\u7559\u767d\u3002",
  "version": "1.0"
}
